[
  {
    "id": "src-similarweb-2026",
    "researchProjectId": "res-proj-blog-ai-relevance",
    "type": "INDUSTRY_RESEARCH",
    "title": "ChatGPT and Google Search User Overlap Telemetry",
    "publisher": "Similarweb",
    "author": "Similarweb Insights Team",
    "url": "https://www.similarweb.com/insights/search-ai-overlap-2026",
    "publicationDate": "2026-05",
    "accessedAt": "2026-09-14T08:30:00Z",
    "language": "en",
    "evidenceLevel": "E3",
    "qualityAssessment": {
      "authority": 92,
      "relevance": 95,
      "recency": 95,
      "methodologicalTransparency": 88,
      "independence": 90,
      "verifiability": 90,
      "qualitySummary": "Data telemetri web global berbasis jutaan panel perangkat dengan metodologi pengukuran konsisten."
    },
    "isPrimarySource": true,
    "isInternal": false,
    "recencyRisk": "LOW",
    "notes": "Menegaskan koeksistensi perilaku Search dan AI (95% overlap).",
    "createdAt": "2026-09-14T08:30:00Z",
    "updatedAt": "2026-09-14T08:30:00Z"
  },
  {
    "id": "src-pew-2025",
    "researchProjectId": "res-proj-blog-ai-relevance",
    "type": "PRIMARY_RESEARCH",
    "title": "Google Users Browsing Activity & AI Summary CTR Empirical Study",
    "publisher": "Pew Research Center",
    "author": "Internet & Technology Research Group",
    "url": "https://www.pewresearch.org/internet/2025/07/google-ai-summary-browsing",
    "publicationDate": "2025-07",
    "accessedAt": "2026-09-14T08:35:00Z",
    "language": "en",
    "evidenceLevel": "E3",
    "qualityAssessment": {
      "authority": 98,
      "relevance": 95,
      "recency": 90,
      "methodologicalTransparency": 96,
      "independence": 98,
      "verifiability": 95,
      "qualitySummary": "Lembaga riset independen nirlaba kelas dunia dengan metodologi sampling ketat terhadap 900 orang dewasa AS."
    },
    "isPrimarySource": true,
    "isInternal": false,
    "recencyRisk": "LOW",
    "notes": "Mengonfirmasi penurunan rasio klik tradisional menjadi 8% saat ada AI Summary vs 15% tanpa AI Summary.",
    "createdAt": "2026-09-14T08:35:00Z",
    "updatedAt": "2026-09-14T08:35:00Z"
  },
  {
    "id": "src-ahrefs-2026",
    "researchProjectId": "res-proj-blog-ai-relevance",
    "type": "INDUSTRY_RESEARCH",
    "title": "Correlating Google AI Overviews with Organic CTR on 300,000 Keywords",
    "publisher": "Ahrefs",
    "author": "Ahrefs Data Science Team",
    "url": "https://ahrefs.com/blog/ai-overviews-ctr-study",
    "publicationDate": "2026-02",
    "accessedAt": "2026-09-14T08:40:00Z",
    "language": "en",
    "evidenceLevel": "E3",
    "qualityAssessment": {
      "authority": 90,
      "relevance": 98,
      "recency": 96,
      "methodologicalTransparency": 92,
      "independence": 86,
      "verifiability": 88,
      "qualitySummary": "Analisis kuantitatif skala masif terhadap 300.000 kata kunci pencarian informational."
    },
    "isPrimarySource": true,
    "isInternal": false,
    "recencyRisk": "LOW",
    "notes": "Mengonfirmasi penurunan CTR posisi #1 organik sebesar ~58% (dari 7.3% menjadi 2.6%).",
    "createdAt": "2026-09-14T08:40:00Z",
    "updatedAt": "2026-09-14T08:40:00Z"
  },
  {
    "id": "src-google-central-2026",
    "researchProjectId": "res-proj-blog-ai-relevance",
    "type": "OFFICIAL_DOCUMENTATION",
    "title": "Optimizing Your Website for Generative AI Features on Google Search",
    "publisher": "Google Search Central",
    "author": "Google Search Relations Team",
    "url": "https://developers.google.com/search/docs/fundamentals/generative-ai-search",
    "publicationDate": "2026-01",
    "accessedAt": "2026-09-14T08:45:00Z",
    "language": "en",
    "evidenceLevel": "E3",
    "qualityAssessment": {
      "authority": 100,
      "relevance": 100,
      "recency": 98,
      "methodologicalTransparency": 90,
      "independence": 80,
      "verifiability": 100,
      "qualitySummary": "Dokumentasi otoritatif resmi pembuat sistem mesin pencari Google."
    },
    "isPrimarySource": true,
    "isInternal": false,
    "recencyRisk": "LOW",
    "notes": "Menyatakan praktik SEO esensial tetap berlaku, menekankan E-E-A-T dan non-commodity content.",
    "createdAt": "2026-09-14T08:45:00Z",
    "updatedAt": "2026-09-14T08:45:00Z"
  },
  {
    "id": "src-cmi-2026",
    "researchProjectId": "res-proj-blog-ai-relevance",
    "type": "INDUSTRY_RESEARCH",
    "title": "B2B Content Trends Report: Owned Media Investment & Channel Shifts",
    "publisher": "Content Marketing Institute",
    "author": "CMI Research Team",
    "url": "https://contentmarketinginstitute.com/research/b2b-trends-2026",
    "publicationDate": "2026-01",
    "accessedAt": "2026-09-14T08:50:00Z",
    "language": "en",
    "evidenceLevel": "E2",
    "qualityAssessment": {
      "authority": 85,
      "relevance": 90,
      "recency": 92,
      "methodologicalTransparency": 82,
      "independence": 85,
      "verifiability": 84,
      "qualitySummary": "Survei tahunan praktisi konten B2B global bereputasi tinggi."
    },
    "isPrimarySource": false,
    "isInternal": false,
    "recencyRisk": "LOW",
    "notes": "Pertumbuhan alokasi investasi pada aset owned media sebesar 32%.",
    "createdAt": "2026-09-14T08:50:00Z",
    "updatedAt": "2026-09-14T08:50:00Z"
  }
]
